<!ELEMENT config (entry)*>

<!ELEMENT entry (string|int|boolean|construct|factory)>
<!ATTLIST entry id ID #IMPLIED>

<!ELEMENT construct (string|int|boolean|construct|factory)*>
<!ATTLIST construct class CDATA #IMPLIED>

<!ELEMENT factory (string|int|boolean|construct|factory)*>
<!ATTLIST factory class CDATA #IMPLIED>
<!ATTLIST factory method CDATA "getInstance">

<!ELEMENT string (#PCDATA)>
<!ELEMENT int (#PCDATA)>
<!ELEMENT boolean (#PCDATA)>
